root@comp3134Winter2022:~# tcpdump -r 0001.pcap
reading from file 0001.pcap, link-type EN10MB (Ethernet)
00:10:49.063737 IP comp3134Winter2022.ssh > cpef85e4242d0f2-cmf85e4242d0f0.cpe.net.cable.rogers.com.53855: Flags [P.], seq 1146133170:1146133214, ack 1637457515, win 501, length 44
00:10:49.063906 IP comp3134Winter2022.ssh > cpef85e4242d0f2-cmf85e4242d0f0.cpe.net.cable.rogers.com.53855: Flags [P.], seq 44:152, ack 1, win 501, length 108
00:10:49.064012 IP comp3134Winter2022.ssh > cpef85e4242d0f2-cmf85e4242d0f0.cpe.net.cable.rogers.com.53855: Flags [P.], seq 152:188, ack 1, win 501, length 36
00:10:49.077065 IP cpef85e4242d0f2-cmf85e4242d0f0.cpe.net.cable.rogers.com.53855 > comp3134Winter2022.ssh: Flags [.], ack 152, win 1021, length 0
00:10:49.077066 IP cpef85e4242d0f2-cmf85e4242d0f0.cpe.net.cable.rogers.com.53855 > comp3134Winter2022.ssh: Flags [.], ack 188, win 1021, length 0
00:10:51.681285 IP 92.63.197.21.58687 > comp3134Winter2022.22524: Flags [S], seq 2224769215, win 1024, length 0
00:10:51.842211 IP ec2-3-8-166-237.eu-west-2.compute.amazonaws.com > comp3134Winter2022: ICMP echo request, id 20, seq 17048, length 16
00:10:51.842284 IP comp3134Winter2022 > ec2-3-8-166-237.eu-west-2.compute.amazonaws.com: ICMP echo reply, id 20, seq 17048, length 16
00:10:53.774819 IP 209.97.152.3.38462 > comp3134Winter2022.ssh: Flags [S], seq 2990135256, win 64240, options [mss 1460,sackOK,TS val 3661958932 ecr 0,nop,wscale 7], length 0
00:10:53.774910 IP comp3134Winter2022 > 209.97.152.3: ICMP comp3134Winter2022 tcp port ssh unreachable, length 68
00:10:55.853328 IP 92.255.85.237.52414 > comp3134Winter2022.ssh: Flags [S], seq 234267970, win 42340, options [mss 1460,sackOK,TS val 446365501 ecr 0,nop,wscale 9], length 0
00:10:55.853427 IP comp3134Winter2022.ssh > 92.255.85.237.52414: Flags [S.], seq 3800057879, ack 234267971, win 65160, options [mss 1460,sackOK,TS val 151410037 ecr 446365501,nop,wscale 7], length 0
00:10:55.993982 IP 92.255.85.237.52414 > comp3134Winter2022.ssh: Flags [.], ack 1, win 83, options [nop,nop,TS val 446365642 ecr 151410037], length 0
00:10:55.994706 IP 92.255.85.237.52414 > comp3134Winter2022.ssh: Flags [P.], seq 1:23, ack 1, win 83, options [nop,nop,TS val 446365643 ecr 151410037], length 22
00:10:55.994746 IP comp3134Winter2022.ssh > 92.255.85.237.52414: Flags [.], ack 23, win 509, options [nop,nop,TS val 151410178 ecr 446365643], length 0
00:10:56.017708 IP comp3134Winter2022.ssh > 92.255.85.237.52414: Flags [P.], seq 1:42, ack 23, win 509, options [nop,nop,TS val 151410201 ecr 446365643], length 41
00:10:56.161067 IP 92.255.85.237.52414 > comp3134Winter2022.ssh: Flags [.], ack 42, win 83, options [nop,nop,TS val 446365809 ecr 151410201], length 0
00:10:56.161068 IP 92.255.85.237.52414 > comp3134Winter2022.ssh: Flags [P.], seq 23:999, ack 42, win 83, options [nop,nop,TS val 446365810 ecr 151410201], length 976
00:10:56.161151 IP comp3134Winter2022.ssh > 92.255.85.237.52414: Flags [P.], seq 42:1098, ack 23, win 509, options [nop,nop,TS val 151410345 ecr 446365809], length 1056
00:10:56.161227 IP comp3134Winter2022.ssh > 92.255.85.237.52414: Flags [.], ack 999, win 502, options [nop,nop,TS val 151410345 ecr 446365810], length 0
00:10:56.302394 IP 92.255.85.237.52414 > comp3134Winter2022.ssh: Flags [.], ack 1098, win 83, options [nop,nop,TS val 446365951 ecr 151410345], length 0
00:10:56.302741 IP 92.255.85.237.52414 > comp3134Winter2022.ssh: Flags [P.], seq 999:1047, ack 1098, win 83, options [nop,nop,TS val 446365951 ecr 151410345], length 48
00:10:56.302777 IP comp3134Winter2022.ssh > 92.255.85.237.52414: Flags [.], ack 1047, win 502, options [nop,nop,TS val 151410486 ecr 446365951], length 0
00:10:56.317522 IP comp3134Winter2022.ssh > 92.255.85.237.52414: Flags [P.], seq 1098:1534, ack 1047, win 502, options [nop,nop,TS val 151410501 ecr 446365951], length 436
00:10:56.451155 IP 92.255.85.237.52414 > comp3134Winter2022.ssh: Flags [.], ack 1534, win 83, options [nop,nop,TS val 446366099 ecr 151410501], length 0
00:10:56.452543 IP 92.255.85.237.52414 > comp3134Winter2022.ssh: Flags [P.], seq 1047:1063, ack 1534, win 83, options [nop,nop,TS val 446366101 ecr 151410501], length 16
00:10:56.452579 IP comp3134Winter2022.ssh > 92.255.85.237.52414: Flags [.], ack 1063, win 502, options [nop,nop,TS val 151410636 ecr 446366101], length 0
00:10:56.595155 IP 92.255.85.237.52414 > comp3134Winter2022.ssh: Flags [P.], seq 1063:1115, ack 1534, win 83, options [nop,nop,TS val 446366244 ecr 151410636], length 52
00:10:56.595221 IP comp3134Winter2022.ssh > 92.255.85.237.52414: Flags [.], ack 1115, win 502, options [nop,nop,TS val 151410779 ecr 446366244], length 0
00:10:56.595408 IP comp3134Winter2022.ssh > 92.255.85.237.52414: Flags [P.], seq 1534:1586, ack 1115, win 502, options [nop,nop,TS val 151410779 ecr 446366244], length 52
00:10:56.738365 IP 92.255.85.237.52414 > comp3134Winter2022.ssh: Flags [P.], seq 1115:1183, ack 1586, win 83, options [nop,nop,TS val 446366387 ecr 151410779], length 68
00:10:56.747702 IP comp3134Winter2022.ssh > 92.255.85.237.52414: Flags [P.], seq 1586:1638, ack 1183, win 502, options [nop,nop,TS val 151410931 ecr 446366387], length 52
00:10:56.891452 IP 92.255.85.237.52414 > comp3134Winter2022.ssh: Flags [P.], seq 1183:1267, ack 1638, win 83, options [nop,nop,TS val 446366540 ecr 151410931], length 84
00:10:56.934333 IP comp3134Winter2022.ssh > 92.255.85.237.52414: Flags [.], ack 1267, win 502, options [nop,nop,TS val 151411118 ecr 446366540], length 0
00:10:57.655537 IP 118.195.134.34.53186 > comp3134Winter2022.ssh: Flags [S], seq 2012466083, win 29200, options [mss 1424,sackOK,TS val 4037269520 ecr 0,nop,wscale 7], length 0
00:10:57.655673 IP comp3134Winter2022.ssh > 118.195.134.34.53186: Flags [S.], seq 3153679825, ack 2012466084, win 65160, options [mss 1460,sackOK,TS val 3480567051 ecr 4037269520,nop,wscale 7], length 0
00:10:57.882592 IP 118.195.134.34.53186 > comp3134Winter2022.ssh: Flags [.], ack 1, win 229, options [nop,nop,TS val 4037269577 ecr 3480567051], length 0
00:10:57.904359 IP comp3134Winter2022.ssh > 118.195.134.34.53186: Flags [P.], seq 1:42, ack 1, win 510, options [nop,nop,TS val 3480567300 ecr 4037269577], length 41
00:10:58.130924 IP 118.195.134.34.53186 > comp3134Winter2022.ssh: Flags [.], ack 42, win 229, options [nop,nop,TS val 4037269639 ecr 3480567300], length 0
00:10:58.133399 IP 118.195.134.34.53186 > comp3134Winter2022.ssh: Flags [P.], seq 1:22, ack 42, win 229, options [nop,nop,TS val 4037269640 ecr 3480567300], length 21
00:10:58.133461 IP comp3134Winter2022.ssh > 118.195.134.34.53186: Flags [.], ack 22, win 510, options [nop,nop,TS val 3480567529 ecr 4037269640], length 0
00:10:58.136279 IP comp3134Winter2022.ssh > 118.195.134.34.53186: Flags [P.], seq 42:1098, ack 22, win 510, options [nop,nop,TS val 3480567532 ecr 4037269640], length 1056
00:10:58.399466 IP 118.195.134.34.53186 > comp3134Winter2022.ssh: Flags [P.], seq 22:462, ack 1098, win 245, options [nop,nop,TS val 4037269706 ecr 3480567532], length 440
00:10:58.399581 IP comp3134Winter2022.ssh > 118.195.134.34.53186: Flags [.], ack 462, win 507, options [nop,nop,TS val 3480567795 ecr 4037269706], length 0
00:10:59.190681 IP comp3134Winter2022.ssh > 92.255.85.237.52414: Flags [P.], seq 1638:1690, ack 1267, win 502, options [nop,nop,TS val 151413374 ecr 446366540], length 52
00:10:59.347756 IP 92.255.85.237.52414 > comp3134Winter2022.ssh: Flags [P.], seq 1267:1319, ack 1690, win 83, options [nop,nop,TS val 446368995 ecr 151413374], length 52
00:10:59.347757 IP 92.255.85.237.52414 > comp3134Winter2022.ssh: Flags [F.], seq 1319, ack 1690, win 83, options [nop,nop,TS val 446368995 ecr 151413374], length 0
00:10:59.347851 IP comp3134Winter2022.ssh > 92.255.85.237.52414: Flags [.], ack 1319, win 502, options [nop,nop,TS val 151413531 ecr 446368995], length 0
00:10:59.352733 IP comp3134Winter2022.ssh > 92.255.85.237.52414: Flags [F.], seq 1690, ack 1320, win 502, options [nop,nop,TS val 151413536 ecr 446368995], length 0
00:10:59.493392 IP 92.255.85.237.52414 > comp3134Winter2022.ssh: Flags [.], ack 1691, win 83, options [nop,nop,TS val 446369142 ecr 151413536], length 0
00:10:59.687223 IP 118.195.134.34.53186 > comp3134Winter2022.ssh: Flags [P.], seq 462:510, ack 1098, win 245, options [nop,nop,TS val 4037270028 ecr 3480567795], length 48
00:10:59.687311 IP comp3134Winter2022.ssh > 118.195.134.34.53186: Flags [.], ack 510, win 507, options [nop,nop,TS val 3480569083 ecr 4037270028], length 0
00:10:59.699019 IP comp3134Winter2022.ssh > 118.195.134.34.53186: Flags [P.], seq 1098:1378, ack 510, win 507, options [nop,nop,TS val 3480569095 ecr 4037270028], length 280
00:10:59.961351 IP 118.195.134.34.53186 > comp3134Winter2022.ssh: Flags [.], ack 1378, win 262, options [nop,nop,TS val 4037270097 ecr 3480569095], length 0
00:11:00.649906 IP 120.92.132.106.28616 > comp3134Winter2022.ssh: Flags [S], seq 967940266, win 29200, options [mss 1460,sackOK,TS val 1319293227 ecr 0,nop,wscale 7], length 0
00:11:00.649982 IP comp3134Winter2022 > 120.92.132.106: ICMP comp3134Winter2022 tcp port ssh unreachable, length 68
00:11:01.089443 IP 118.195.134.34.53186 > comp3134Winter2022.ssh: Flags [P.], seq 526:578, ack 1378, win 262, options [nop,nop,TS val 4037270379 ecr 3480569095], length 52
00:11:01.089521 IP comp3134Winter2022.ssh > 118.195.134.34.53186: Flags [.], ack 510, win 507, options [nop,nop,TS val 3480570485 ecr 4037270097,nop,nop,sack 1 {526:578}], length 0
00:11:01.191950 IP vmi399769.contaboserver.net.46067 > comp3134Winter2022.5071: Flags [S], seq 3027057542, win 1024, length 0
00:11:01.373528 IP 118.195.134.34.53186 > comp3134Winter2022.ssh: Flags [P.], seq 510:526, ack 1378, win 262, options [nop,nop,TS val 4037270450 ecr 3480570485], length 16
00:11:01.373625 IP comp3134Winter2022.ssh > 118.195.134.34.53186: Flags [.], ack 578, win 507, options [nop,nop,TS val 3480570769 ecr 4037270450], length 0
00:11:01.373877 IP comp3134Winter2022.ssh > 118.195.134.34.53186: Flags [P.], seq 1378:1430, ack 578, win 507, options [nop,nop,TS val 3480570770 ecr 4037270450], length 52
00:11:01.558410 IP 189-213-49-151.static.axtel.net.33922 > comp3134Winter2022.telnet: Flags [S], seq 1865741514, win 5840, options [mss 1460,sackOK,TS val 265824710 ecr 0,nop,wscale 2], length 0
00:11:01.600202 IP 118.195.134.34.53186 > comp3134Winter2022.ssh: Flags [.], ack 1430, win 262, options [nop,nop,TS val 4037270506 ecr 3480570770], length 0
00:11:01.650880 IP 120.92.132.106.28616 > comp3134Winter2022.ssh: Flags [S], seq 967940266, win 29200, options [mss 1460,sackOK,TS val 1319294228 ecr 0,nop,wscale 7], length 0
00:11:01.650957 IP comp3134Winter2022 > 120.92.132.106: ICMP comp3134Winter2022 tcp port ssh unreachable, length 68
00:11:03.654786 IP 120.92.132.106.28616 > comp3134Winter2022.ssh: Flags [S], seq 967940266, win 29200, options [mss 1460,sackOK,TS val 1319296232 ecr 0,nop,wscale 7], length 0
00:11:03.654892 IP comp3134Winter2022 > 120.92.132.106: ICMP comp3134Winter2022 tcp port ssh unreachable, length 68
00:11:04.557999 IP 189-213-49-151.static.axtel.net.33922 > comp3134Winter2022.telnet: Flags [S], seq 1865741514, win 5840, options [mss 1460,sackOK,TS val 265827710 ecr 0,nop,wscale 2], length 0
00:11:06.213483 IP 118.195.134.34.53186 > comp3134Winter2022.ssh: Flags [P.], seq 578:662, ack 1430, win 262, options [nop,nop,TS val 4037271660 ecr 3480570770], length 84
00:11:06.254311 IP comp3134Winter2022.ssh > 118.195.134.34.53186: Flags [.], ack 662, win 507, options [nop,nop,TS val 3480575650 ecr 4037271660], length 0
00:11:07.662875 IP 120.92.132.106.28616 > comp3134Winter2022.ssh: Flags [S], seq 967940266, win 29200, options [mss 1460,sackOK,TS val 1319300240 ecr 0,nop,wscale 7], length 0
00:11:07.662955 IP comp3134Winter2022 > 120.92.132.106: ICMP comp3134Winter2022 tcp port ssh unreachable, length 68
00:11:08.764180 IP 43.154.95.224.33686 > comp3134Winter2022.ssh: Flags [S], seq 2794041617, win 29200, options [mss 1424,sackOK,TS val 4267348427 ecr 0,nop,wscale 7], length 0
00:11:08.764255 IP comp3134Winter2022 > 43.154.95.224: ICMP comp3134Winter2022 tcp port ssh unreachable, length 68
00:11:09.936405 IP comp3134Winter2022.ssh > 118.195.134.34.53186: Flags [P.], seq 1430:1498, ack 662, win 507, options [nop,nop,TS val 3480579332 ecr 4037271660], length 68
00:11:10.162798 IP 118.195.134.34.53186 > comp3134Winter2022.ssh: Flags [.], ack 1498, win 262, options [nop,nop,TS val 4037272647 ecr 3480579332], length 0
00:11:10.162798 IP 118.195.134.34.53186 > comp3134Winter2022.ssh: Flags [P.], seq 662:714, ack 1498, win 262, options [nop,nop,TS val 4037272647 ecr 3480579332], length 52
00:11:10.162798 IP 118.195.134.34.53186 > comp3134Winter2022.ssh: Flags [F.], seq 714, ack 1498, win 262, options [nop,nop,TS val 4037272647 ecr 3480579332], length 0
00:11:10.162880 IP comp3134Winter2022.ssh > 118.195.134.34.53186: Flags [.], ack 714, win 507, options [nop,nop,TS val 3480579559 ecr 4037272647], length 0
00:11:10.166906 IP comp3134Winter2022.ssh > 118.195.134.34.53186: Flags [F.], seq 1498, ack 715, win 507, options [nop,nop,TS val 3480579563 ecr 4037272647], length 0
00:11:10.393152 IP 118.195.134.34.53186 > comp3134Winter2022.ssh: Flags [.], ack 1499, win 262, options [nop,nop,TS val 4037272704 ecr 3480579563], length 0
00:11:10.558349 IP 189-213-49-151.static.axtel.net.33922 > comp3134Winter2022.telnet: Flags [S], seq 1865741514, win 5840, options [mss 1460,sackOK,TS val 265833710 ecr 0,nop,wscale 2], length 0
00:11:10.858915 IP 29.88.224.208.52079 > comp3134Winter2022.telnet: Flags [S], seq 893321357, win 5840, options [mss 1460,sackOK,TS val 253713585 ecr 0,nop,wscale 2], length 0
00:11:10.921632 IP 178.62.119.91.45766 > comp3134Winter2022.ssh: Flags [S], seq 1928032690, win 29200, options [mss 1460,sackOK,TS val 3909303580 ecr 0,nop,wscale 7], length 0
00:11:10.921762 IP comp3134Winter2022 > 178.62.119.91: ICMP comp3134Winter2022 tcp port ssh unreachable, length 68
00:11:13.164743 IP scanner-11.ch1.censys-scanner.com.26109 > comp3134Winter2022.4043: Flags [S], seq 3101352897, win 1024, options [mss 1460], length 0
00:11:13.857987 IP 29.88.224.208.52079 > comp3134Winter2022.telnet: Flags [S], seq 893321357, win 5840, options [mss 1460,sackOK,TS val 253716586 ecr 0,nop,wscale 2], length 0
00:11:14.334731 IP soda.census.shodan.io.23320 > comp3134Winter2022.8083: Flags [S], seq 1592102426, win 15197, options [mss 1460], length 0
00:11:14.352534 IP 66.240.192.82.41047 > comp3134Winter2022.ms-sql-s: Flags [S], seq 3474056708, win 65535, options [mss 1460], length 0
00:11:19.858058 IP 29.88.224.208.52079 > comp3134Winter2022.telnet: Flags [S], seq 893321357, win 5840, options [mss 1460,sackOK,TS val 253722586 ecr 0,nop,wscale 2], length 0
00:11:22.461020 IP comp3134Winter2022.48070 > 169.254.169.254.http: Flags [S], seq 2116652135, win 64240, options [mss 1460,sackOK,TS val 1261843466 ecr 0,nop,wscale 7], length 0
00:11:22.462681 IP 169.254.169.254.http > comp3134Winter2022.48070: Flags [S.], seq 1097933301, ack 2116652136, win 28960, options [mss 1460,sackOK,TS val 2779995033 ecr 1261843466,nop,wscale 7], length 0
00:11:22.462746 IP comp3134Winter2022.48070 > 169.254.169.254.http: Flags [.], ack 1, win 502, options [nop,nop,TS val 1261843467 ecr 2779995033], length 0
00:11:22.463020 IP comp3134Winter2022.48070 > 169.254.169.254.http: Flags [P.], seq 1:1088, ack 1, win 502, options [nop,nop,TS val 1261843468 ecr 2779995033], length 1087: HTTP: POST /v1/metrics/droplet_id/281762693 HTTP/1.1
00:11:22.463286 IP 169.254.169.254.http > comp3134Winter2022.48070: Flags [.], ack 1088, win 249, options [nop,nop,TS val 2779995035 ecr 1261843468], length 0
00:11:22.483909 IP 169.254.169.254.http > comp3134Winter2022.48070: Flags [P.], seq 1:228, ack 1088, win 249, options [nop,nop,TS val 2779995055 ecr 1261843468], length 227: HTTP: HTTP/1.1 202 Accepted
00:11:22.483981 IP comp3134Winter2022.48070 > 169.254.169.254.http: Flags [.], ack 228, win 501, options [nop,nop,TS val 1261843489 ecr 2779995055], length 0
00:11:22.484184 IP 169.254.169.254.http > comp3134Winter2022.48070: Flags [F.], seq 228, ack 1088, win 249, options [nop,nop,TS val 2779995056 ecr 1261843489], length 0
00:11:22.484437 IP comp3134Winter2022.48070 > 169.254.169.254.http: Flags [F.], seq 1088, ack 229, win 501, options [nop,nop,TS val 1261843489 ecr 2779995056], length 0
00:11:22.484565 IP 169.254.169.254.http > comp3134Winter2022.48070: Flags [.], ack 1089, win 249, options [nop,nop,TS val 2779995056 ecr 1261843489], length 0
00:11:22.557501 IP 189-213-49-151.static.axtel.net.33922 > comp3134Winter2022.telnet: Flags [S], seq 1865741514, win 5840, options [mss 1460,sackOK,TS val 265845710 ecr 0,nop,wscale 2], length 0
00:11:22.739663 IP 45.134.26.42.50749 > comp3134Winter2022.6465: Flags [S], seq 967323694, win 1024, length 0
00:11:23.955742 IP 209.97.152.3.45828 > comp3134Winter2022.ssh: Flags [S], seq 3620816711, win 64240, options [mss 1460,sackOK,TS val 3661989111 ecr 0,nop,wscale 7], length 0
00:11:23.955822 IP comp3134Winter2022 > 209.97.152.3: ICMP comp3134Winter2022 tcp port ssh unreachable, length 68
00:11:25.671021 IP ec2-35-154-188-15.ap-south-1.compute.amazonaws.com.54648 > comp3134Winter2022.ssh: Flags [S], seq 1512119028, win 26883, options [mss 1460,sackOK,TS val 1411286627 ecr 0,nop,wscale 7], length 0
00:11:25.671098 IP comp3134Winter2022 > ec2-35-154-188-15.ap-south-1.compute.amazonaws.com: ICMP comp3134Winter2022 tcp port ssh unreachable, length 68
00:11:26.294999 IP 120.92.132.106.32712 > comp3134Winter2022.ssh: Flags [S], seq 2663196449, win 29200, options [mss 1460,sackOK,TS val 1319318855 ecr 0,nop,wscale 7], length 0
00:11:26.295077 IP comp3134Winter2022 > 120.92.132.106: ICMP comp3134Winter2022 tcp port ssh unreachable, length 68
00:11:26.929450 IP 81.70.236.203.39480 > comp3134Winter2022.ssh: Flags [S], seq 2766120939, win 29200, options [mss 1424,sackOK,TS val 68208358 ecr 0,nop,wscale 7], length 0
00:11:26.929529 IP comp3134Winter2022 > 81.70.236.203: ICMP comp3134Winter2022 tcp port ssh unreachable, length 68
00:11:27.294947 IP 120.92.132.106.32712 > comp3134Winter2022.ssh: Flags [S], seq 2663196449, win 29200, options [mss 1460,sackOK,TS val 1319319856 ecr 0,nop,wscale 7], length 0
00:11:27.295070 IP comp3134Winter2022.ssh > 120.92.132.106.32712: Flags [S.], seq 884120039, ack 2663196450, win 65160, options [mss 1460,sackOK,TS val 2969643245 ecr 1319319856,nop,wscale 7], length 0
00:11:27.450612 IP 92.63.197.21.58687 > comp3134Winter2022.45628: Flags [S], seq 1342766501, win 1024, length 0
00:11:27.540962 IP 120.92.132.106.32712 > comp3134Winter2022.ssh: Flags [.], ack 1, win 229, options [nop,nop,TS val 1319320102 ecr 2969643245], length 0
00:11:27.562598 IP comp3134Winter2022.ssh > 120.92.132.106.32712: Flags [P.], seq 1:42, ack 1, win 510, options [nop,nop,TS val 2969643512 ecr 1319320102], length 41
00:11:27.807956 IP 120.92.132.106.32712 > comp3134Winter2022.ssh: Flags [.], ack 42, win 229, options [nop,nop,TS val 1319320368 ecr 2969643512], length 0
00:11:27.807957 IP 120.92.132.106.32712 > comp3134Winter2022.ssh: Flags [P.], seq 1:22, ack 42, win 229, options [nop,nop,TS val 1319320369 ecr 2969643512], length 21
00:11:27.808032 IP comp3134Winter2022.ssh > 120.92.132.106.32712: Flags [.], ack 22, win 510, options [nop,nop,TS val 2969643758 ecr 1319320369], length 0
00:11:27.810342 IP comp3134Winter2022.ssh > 120.92.132.106.32712: Flags [P.], seq 42:1098, ack 22, win 510, options [nop,nop,TS val 2969643760 ecr 1319320369], length 1056
00:11:28.057046 IP 120.92.132.106.32712 > comp3134Winter2022.ssh: Flags [P.], seq 22:462, ack 1098, win 245, options [nop,nop,TS val 1319320618 ecr 2969643760], length 440
00:11:28.057141 IP comp3134Winter2022.ssh > 120.92.132.106.32712: Flags [.], ack 462, win 507, options [nop,nop,TS val 2969644007 ecr 1319320618], length 0
00:11:28.302364 IP 120.92.132.106.32712 > comp3134Winter2022.ssh: Flags [P.], seq 462:510, ack 1098, win 245, options [nop,nop,TS val 1319320863 ecr 2969644007], length 48
00:11:28.302431 IP comp3134Winter2022.ssh > 120.92.132.106.32712: Flags [.], ack 510, win 507, options [nop,nop,TS val 2969644252 ecr 1319320863], length 0
00:11:28.315071 IP comp3134Winter2022.ssh > 120.92.132.106.32712: Flags [P.], seq 1098:1378, ack 510, win 507, options [nop,nop,TS val 2969644265 ecr 1319320863], length 280
00:11:28.566097 IP 120.92.132.106.32712 > comp3134Winter2022.ssh: Flags [P.], seq 510:526, ack 1378, win 262, options [nop,nop,TS val 1319321127 ecr 2969644265], length 16
00:11:28.566188 IP comp3134Winter2022.ssh > 120.92.132.106.32712: Flags [.], ack 526, win 507, options [nop,nop,TS val 2969644516 ecr 1319321127], length 0
00:11:28.605288 IP 218.92.0.205.60830 > comp3134Winter2022.ssh: Flags [S], seq 1958474188, win 29200, options [mss 1460,sackOK,TS val 1930277703 ecr 0,nop,wscale 7], length 0
00:11:28.605395 IP comp3134Winter2022.ssh > 218.92.0.205.60830: Flags [S.], seq 4077684546, ack 1958474189, win 65160, options [mss 1460,sackOK,TS val 3046055702 ecr 1930277703,nop,wscale 7], length 0
00:11:28.811413 IP 120.92.132.106.32712 > comp3134Winter2022.ssh: Flags [P.], seq 526:578, ack 1378, win 262, options [nop,nop,TS val 1319321372 ecr 2969644516], length 52
00:11:28.811480 IP comp3134Winter2022.ssh > 120.92.132.106.32712: Flags [.], ack 578, win 507, options [nop,nop,TS val 2969644761 ecr 1319321372], length 0
00:11:28.811698 IP comp3134Winter2022.ssh > 120.92.132.106.32712: Flags [P.], seq 1378:1430, ack 578, win 507, options [nop,nop,TS val 2969644761 ecr 1319321372], length 52
00:11:28.849347 IP 218.92.0.205.60830 > comp3134Winter2022.ssh: Flags [.], ack 1, win 229, options [nop,nop,TS val 1930277765 ecr 3046055702], length 0
00:11:28.849348 IP 218.92.0.205.60830 > comp3134Winter2022.ssh: Flags [P.], seq 1:16, ack 1, win 229, options [nop,nop,TS val 1930277765 ecr 3046055702], length 15
00:11:28.873144 IP comp3134Winter2022.ssh > 218.92.0.205.60830: Flags [P.], seq 1:42, ack 1, win 510, options [nop,nop,TS val 3046055970 ecr 1930277765], length 41
tcpdump: pcap_loop: truncated dump file; tried to read 150 captured bytes, only got 69
