00:13:52.163081 IP 159.203.60.110.22 > 99.248.229.164.53855: Flags [P.], seq 5725176:5725340, ack 2845, win 501, length 164
00:13:52.163199 IP 159.203.60.110.22 > 99.248.229.164.53855: Flags [P.], seq 5725340:5725504, ack 2845, win 501, length 164
00:13:52.163322 IP 159.203.60.110.22 > 99.248.229.164.53855: Flags [P.], seq 5725504:5725668, ack 2845, win 501, length 164
00:13:52.163446 IP 159.203.60.110.22 > 99.248.229.164.53855: Flags [P.], seq 5725668:5725832, ack 2845, win 501, length 164
00:13:52.163568 IP 159.203.60.110.22 > 99.248.229.164.53855: Flags [P.], seq 5725832:5725996, ack 2845, win 501, length 164
00:13:52.163714 IP 159.203.60.110.22 > 99.248.229.164.53855: Flags [P.], seq 5725996:5726160, ack 2845, win 501, length 164
00:13:52.163836 IP 159.203.60.110.22 > 99.248.229.164.53855: Flags [P.], seq 5726160:5726324, ack 2845, win 501, length 164
00:13:52.163973 IP 159.203.60.110.22 > 99.248.229.164.53855: Flags [P.], seq 5726324:5726488, ack 2845, win 501, length 164
00:13:52.164094 IP 159.203.60.110.22 > 99.248.229.164.53855: Flags [P.], seq 5726488:5726652, ack 2845, win 501, length 164
00:13:52.164214 IP 159.203.60.110.22 > 99.248.229.164.53855: Flags [P.], seq 5726652:5726816, ack 2845, win 501, length 164
00:13:52.164338 IP 159.203.60.110.22 > 99.248.229.164.53855: Flags [P.], seq 5726816:5726980, ack 2845, win 501, length 164
00:13:52.164456 IP 159.203.60.110.22 > 99.248.229.164.53855: Flags [P.], seq 5726980:5727144, ack 2845, win 501, length 164
00:13:52.164586 IP 159.203.60.110.22 > 99.248.229.164.53855: Flags [P.], seq 5727144:5727308, ack 2845, win 501, length 164
00:13:52.164724 IP 159.203.60.110.22 > 99.248.229.164.53855: Flags [P.], seq 5727308:5727472, ack 2845, win 501, length 164
00:13:52.164842 IP 159.203.60.110.22 > 99.248.229.164.53855: Flags [P.], seq 5727472:5727636, ack 2845, win 501, length 164
00:13:52.164969 IP 159.203.60.110.22 > 99.248.229.164.53855: Flags [P.], seq 5727636:5727800, ack 2845, win 501, length 164
00:13:52.165086 IP 159.203.60.110.22 > 99.248.229.164.53855: Flags [P.], seq 5727800:5727964, ack 2845, win 501, length 164
00:13:52.165205 IP 159.203.60.110.22 > 99.248.229.164.53855: Flags [P.], seq 5727964:5728128, ack 2845, win 501, length 164
00:13:52.165331 IP 159.203.60.110.22 > 99.248.229.164.53855: Flags [P.], seq 5728128:5728292, ack 2845, win 501, length 164
00:13:52.165449 IP 159.203.60.110.22 > 99.248.229.164.53855: Flags [P.], seq 5728292:5728456, ack 2845, win 501, length 164
00:13:52.165568 IP 159.203.60.110.22 > 99.248.229.164.53855: Flags [P.], seq 5728456:5728620, ack 2845, win 501, length 164
00:13:52.165695 IP 159.203.60.110.22 > 99.248.229.164.53855: Flags [P.], seq 5728620:5728784, ack 2845, win 501, length 164
00:13:52.165816 IP 159.203.60.110.22 > 99.248.229.164.53855: Flags [P.], seq 5728784:5728948, ack 2845, win 501, length 164
00:13:52.165940 IP 159.203.60.110.22 > 99.248.229.164.53855: Flags [P.], seq 5728948:5729112, ack 2845, win 501, length 164
00:13:52.166063 IP 159.203.60.110.22 > 99.248.229.164.53855: Flags [P.], seq 5729112:5729276, ack 2845, win 501, length 164
00:13:52.166182 IP 159.203.60.110.22 > 99.248.229.164.53855: Flags [P.], seq 5729276:5729440, ack 2845, win 501, length 164
00:13:52.166328 IP 159.203.60.110.22 > 99.248.229.164.53855: Flags [P.], seq 5729440:5729604, ack 2845, win 501, length 164
00:13:52.166474 IP 159.203.60.110.22 > 99.248.229.164.53855: Flags [P.], seq 5729604:5729768, ack 2845, win 501, length 164
00:13:52.166600 IP 159.203.60.110.22 > 99.248.229.164.53855: Flags [P.], seq 5729768:5729932, ack 2845, win 501, length 164
00:13:52.166719 IP 159.203.60.110.22 > 99.248.229.164.53855: Flags [P.], seq 5729932:5730096, ack 2845, win 501, length 164
00:13:52.166844 IP 159.203.60.110.22 > 99.248.229.164.53855: Flags [P.], seq 5730096:5730260, ack 2845, win 501, length 164
00:13:52.166982 IP 159.203.60.110.22 > 99.248.229.164.53855: Flags [P.], seq 5730260:5730424, ack 2845, win 501, length 164
00:13:52.167105 IP 159.203.60.110.22 > 99.248.229.164.53855: Flags [P.], seq 5730424:5730588, ack 2845, win 501, length 164
00:13:52.167158 IP 99.248.229.164.53855 > 159.203.60.110.22: Flags [.], ack 5720488, win 52, length 0
00:13:52.167343 IP 159.203.60.110.22 > 99.248.229.164.53855: Flags [P.], seq 5730588:5730856, ack 2845, win 501, length 268
00:13:52.167476 IP 159.203.60.110.22 > 99.248.229.164.53855: Flags [P.], seq 5730856:5731020, ack 2845, win 501, length 164
00:13:52.167603 IP 159.203.60.110.22 > 99.248.229.164.53855: Flags [P.], seq 5731020:5731184, ack 2845, win 501, length 164
00:13:52.167900 IP 159.203.60.110.22 > 99.248.229.164.53855: Flags [P.], seq 5731184:5731348, ack 2845, win 501, length 164
00:13:52.168034 IP 159.203.60.110.22 > 99.248.229.164.53855: Flags [P.], seq 5731348:5731512, ack 2845, win 501, length 164
00:13:52.168155 IP 159.203.60.110.22 > 99.248.229.164.53855: Flags [P.], seq 5731512:5731676, ack 2845, win 501, length 164
00:13:52.168276 IP 159.203.60.110.22 > 99.248.229.164.53855: Flags [P.], seq 5731676:5731840, ack 2845, win 501, length 164
00:13:52.168395 IP 159.203.60.110.22 > 99.248.229.164.53855: Flags [P.], seq 5731840:5732004, ack 2845, win 501, length 164
00:13:52.168518 IP 159.203.60.110.22 > 99.248.229.164.53855: Flags [P.], seq 5732004:5732168, ack 2845, win 501, length 164
00:13:52.168663 IP 159.203.60.110.22 > 99.248.229.164.53855: Flags [P.], seq 5732168:5732332, ack 2845, win 501, length 164
00:13:52.168789 IP 159.203.60.110.22 > 99.248.229.164.53855: Flags [P.], seq 5732332:5732496, ack 2845, win 501, length 164
00:13:52.168919 IP 159.203.60.110.22 > 99.248.229.164.53855: Flags [P.], seq 5732496:5732660, ack 2845, win 501, length 164
00:13:52.169043 IP 159.203.60.110.22 > 99.248.229.164.53855: Flags [P.], seq 5732660:5732824, ack 2845, win 501, length 164
00:13:52.169168 IP 159.203.60.110.22 > 99.248.229.164.53855: Flags [P.], seq 5732824:5732988, ack 2845, win 501, length 164
00:13:52.169288 IP 159.203.60.110.22 > 99.248.229.164.53855: Flags [P.], seq 5732988:5733152, ack 2845, win 501, length 164
00:13:52.169406 IP 159.203.60.110.22 > 99.248.229.164.53855: Flags [P.], seq 5733152:5733316, ack 2845, win 501, length 164
00:13:52.169524 IP 159.203.60.110.22 > 99.248.229.164.53855: Flags [P.], seq 5733316:5733480, ack 2845, win 501, length 164
00:13:52.169642 IP 159.203.60.110.22 > 99.248.229.164.53855: Flags [P.], seq 5733480:5733644, ack 2845, win 501, length 164
00:13:52.175841 IP 99.248.229.164.53855 > 159.203.60.110.22: Flags [.], ack 5733644, win 1, length 0
00:13:52.175955 IP 159.203.60.110.22 > 99.248.229.164.53855: Flags [P.], seq 5733644:5733808, ack 2845, win 501, length 164
00:13:52.182497 IP 99.248.229.164.53855 > 159.203.60.110.22: Flags [.], ack 5733808, win 0, length 0
00:13:52.204000 IP 99.248.229.164.53855 > 159.203.60.110.22: Flags [P.], seq 2845:2917, ack 5733808, win 0, length 72
00:13:52.204304 IP 159.203.60.110.22 > 99.248.229.164.53855: Flags [.], ack 2917, win 501, length 0
00:13:52.287361 IP 99.248.229.164.53855 > 159.203.60.110.22: Flags [.], ack 5733808, win 1026, length 0
00:13:52.287361 IP 99.248.229.164.53855 > 159.203.60.110.22: Flags [P.], seq 2917:2989, ack 5733808, win 1026, length 72
00:13:52.287451 IP 159.203.60.110.22 > 99.248.229.164.53855: Flags [P.], seq 5733808:5734512, ack 2917, win 501, length 704
^Z
[6]+  Stopped                 tcpdump -n -i eth0
